### ISSUE TITLE
GNS3 GUI is not able to communicate with one of my GNS3 VM. 

### ISSUE THREAD

**Issue by chunji08** [GNS3/gns3-gui#3308]
Hi there, 
I am not sure if this is a bug yet, but I really need to find out the root cause as it is blocking my rest work. Appreciated if someone can help me.  

Here is my GNS3 working environment: 
1. I have a GNS3 UI installed on window 10, which is of version 2.2.26. 
2. I have a bunch of GNS3 VM created on VMWARE server, which are also of version 2.2.26, and they are able to communicate with this GNS3 UI. 
3. I have another GNS3 VM, which is installed on a private cloud service, it is of GNS3 version 2.2.26, and its IP address is : **10.96.128.81**.  But this one is not able to talk to the GNS3 UI, as you may find in the bottom attachment. 

- here are details when I ssh to that VM, as I can see gns3 is up and running at port 3080. 

```
root@us-880:/home/ubuntu# gns3server -v
2.2.26
root@us-880:/home/ubuntu# systemctl -l status gns3
● gns3.service - GNS3 server
     Loaded: loaded (/lib/systemd/system/gns3.service; enabled; vendor preset: enabled)
     Active: active (running) since Tue 2022-03-22 17:30:55 UTC; 1h 0min ago
    Process: 24884 ExecStartPre=/bin/mkdir -p /var/log/gns3 /var/run/gns3 (code=exited, status=0/SUCCESS)
    Process: 24891 ExecStartPre=/bin/chown -R gns3:gns3 /var/log/gns3 /var/run/gns3 (code=exited, status=0/SUCCESS)
   Main PID: 24897 (gns3server)
      Tasks: 5 (limit: 19169)
     Memory: 37.8M
     CGroup: /system.slice/gns3.service
             └─24897 /usr/bin/python3 /usr/local/bin/gns3server --log /var/log/gns3/gns3.log

Mar 22 17:30:55 us-880 systemd[1]: Starting GNS3 server...
Mar 22 17:30:55 us-880 systemd[1]: Started GNS3 server.
root@us-880:/home/ubuntu# netstat -tlunp
Active Internet connections (only servers)
Proto Recv-Q Send-Q Local Address           Foreign Address         State       PID/Program name
tcp        0      0 0.0.0.0:3080            0.0.0.0:*               LISTEN      24897/python3
tcp        0      0 192.168.122.1:53        0.0.0.0:*               LISTEN      14196/dnsmasq
tcp        0      0 127.0.0.53:53           0.0.0.0:*               LISTEN      764/systemd-resolve
tcp        0      0 0.0.0.0:22              0.0.0.0:*               LISTEN      1574/sshd: /usr/sbi
tcp6       0      0 :::22                   :::*                    LISTEN      1574/sshd: /usr/sbi
udp        0      0 192.168.122.1:53        0.0.0.0:*                           14196/dnsmasq
udp        0      0 127.0.0.53:53           0.0.0.0:*                           764/systemd-resolve
udp        0      0 0.0.0.0:67              0.0.0.0:*                           14196/dnsmasq
udp        0      0 10.31.2.237:68          0.0.0.0:*                           843/systemd-network

``` 
- and here is the contents if I was to access http://10.96.128.81:3080 from my local browser. 
![image](https://user-images.githubusercontent.com/11307533/159551715-3bb86e19-b6ed-4e03-ad6e-8fe32153bcab.png)

Everything looks good to me, except the status from GNS3 UI.  Here is the picture of my GNS3 UI remote servers page, and at the right side, are the remote server status, as we may find **10.96.128.81** is not in the active mode. 
![image](https://user-images.githubusercontent.com/11307533/159552167-af6c9b3f-1ad8-4db6-ac2c-e71275cb2901.png)

Any ideas what could be wrong ? Do we know where are the log message for the GUI and VM connections ? 

Thanks a lot for the help. 

Chun Ji

**Comment by chunji08** [comment]
Updates:
 I have try to use port 80 instead of 3080, but this connection issue stays.

**Comment by josephmhiggins** [comment]
Yeah, I had the same symptom after upgrading to ubuntu 20.04 and then I upgraded to gns3 2.2.31, but I was running without a GNS3 VM and using KVM as my hypervisor, and I was running using ubuntu 20.04 as a remote server - for the first time -and I was using Windows 10 as a GUI. So it could have been anything.

I left everything as the defaults on the Ubuntu 20.04 and the interface my Ubuntu 20.04 that is exposed to my private wan - my home lab and I did:

x@y:$ gns3server 
2022-03-24 10:02:16 INFO run.py:219 GNS3 server version 2.2.31
2022-03-24 10:02:16 INFO run.py:221 Copyright (c) 2007-2022 GNS3 Technologies Inc.
2022-03-24 10:02:16 INFO run.py:224 Config file /home/x/.config/GNS3/2.2/gns3_server.conf loaded
2022-03-24 10:02:16 INFO run.py:243 Running with Python 3.8.10 and has PID 19533
2022-03-24 10:02:16 INFO run.py:79 Current locale is en_US.UTF-8
2022-03-24 10:02:17 INFO web_server.py:318 Starting server on 0.0.0.0:3080
2022-03-24 10:02:17 INFO __init__.py:63 Load controller configuration file /home/x/.config/GNS3/2.2/gns3_controller.conf
2022-03-24 10:02:17 INFO __init__.py:67 Controller is starting
2022-03-24 10:02:17 INFO compute.py:64 Create compute local
2022-03-24 10:02:17 INFO compute.py:364 Connecting to compute 'local'

My Windows 10 machine, ip address 192.168.33.193, I then tried to connect to the remote Ubuntu server, ip address 192.168.33.194

I opened a new ssh connection to my Ubuntu server and did
x@y:$ ss -lntp
State    Recv-Q   Send-Q     Local Address:Port       Peer Address:Port   Process                                  
LISTEN   0        32         192.168.122.1:53              0.0.0.0:*                                               
LISTEN   0        4096       127.0.0.53%lo:53              0.0.0.0:*                                               
LISTEN   0        128              0.0.0.0:22              0.0.0.0:*                                               
LISTEN   0        5              127.0.0.1:631             0.0.0.0:*                                               
LISTEN   0        100              0.0.0.0:3080            0.0.0.0:*       users:(("gns3server",pid=19533,fd=6))   
LISTEN   0        128                 [::]:22                 [::]:*                                               
LISTEN   0        5                  [::1]:631                [::]:*                                               
x@y:~$

Then i opened yet another ssh connection to my Ubuntu server and did
x@y:$ sudo tcpdump -vv -c 50 -t -i br0 port 3080
tcpdump: listening on br0, link-type EN10MB (Ethernet), capture size 262144 bytes
IP (tos 0x0, ttl 128, id 3504, offset 0, flags [DF], proto TCP (6), length 52)
    192.168.33.193.58069 > y.gns3.local.3080: Flags [S], cksum 0x9dac (correct), seq 2597685227, win 64240, options [mss 1460,nop,wscale 8,nop,nop,sackOK], length 0
----- snip -----
IP (tos 0x0, ttl 128, id 3519, offset 0, flags [DF], proto TCP (6), length 52)
    192.168.33.193.58139 > y.gns3.local.3080: Flags [S], cksum 0x8e71 (correct), seq 450107106, win 64240, options [mss 1460,nop,wscale 8,nop,nop,sackOK], length 0

I noticed the port kept changing from 192.168.33.193

**Then I changed something.**

Then from up above, I got this in the log:
2022-03-24 10:32:56 INFO web_log.py:206 192.168.33.193 [24/Mar/2022:10:32:56 +0000] "GET /v2/version HTTP/1.1" 200 228 "-" "GNS3 QT Client v2.2.31"
2022-03-24 10:32:56 INFO notification_handler.py:73 New client has connected to controller WebSocket

and I did:
x@y:$ sudo tcpdump -vv -c 50 -t -i br0 port 3080
[sudo] password for x: 
Sorry, try again.
[sudo] password for x: 
tcpdump: listening on br0, link-type EN10MB (Ethernet), capture size 262144 bytes

----- and the remote port stopped changing ------------
IP (tos 0x0, ttl 128, id 9017, offset 0, flags [DF], proto TCP (6), length 40)
    192.168.33.193.58541 > y.gns3.local.3080: Flags [.], cksum 0x283f (correct), seq 1, ack 4500, win 1022, length 0
^C
18 packets captured
18 packets received by filter
0 packets dropped by kernel
x@y:$ 

"Any ideas what could be wrong ? Do we know where are the log message for the GUI and VM connections ?"
--- Do we know where are the log message for the GUI and VM connections ? ---- Nope, I do not know.

I am not running an GNS3 VM Linux, so the fix may be something different

**Comment by josephmhiggins** [comment]
Oh, I only cared about getting the remote GNS3 server green and not running a project or anything as sophisticated as that. My remote server is green. As you can see from the picture, it took me about 88 x 30 seconds to fix it. I would wait for the gns3 developers to reply, or check out David Bombal's videos on remote servers, or run a powershell command to find "dummy" in the source code - which in this case would be "*.log "

![web-server-is-green](https://user-images.githubusercontent.com/85327995/159932794-2727f674-a534-4c9f-b466-2453c0ae1426.PNG)

**Comment by chunji08** [comment]
Thanks for the tips. I have just realized that this VM would be "green", if I have used it  as the main server. but I was to put it in the remote server list, it would be greyed out.
