### ISSUE TITLE
gns3 2.2.55 Traffic Egressing via Incorrect Interface (ens18 Instead of ens20) When Using Cloud Node in GNS3

### ISSUE THREAD

**Issue by Lchugh** [GNS3/gns3-gui#3764]
Hi everyone,

I’m running GNS3  2.2.55 on Ubuntu with a host that has two interfaces: ens18 and ens20. 

I configured ens20 as a DHCP server directly on the Ubuntu host. In GNS3, I attached the Cloud node to ens20 and connected a VPC to that cloud interface. The VPC successfully obtains an IP address via DHCP from ens20, confirming Layer-2/L3 reachability for the initial address assignment.

 Problem:
When I initiate ICMP traffic (pinging the default gateway) from the VPC, the traffic is being forwarded via ens18 instead of ens20, even though the VPC is logically connected to the cloud interface backed by ens20, getting icmp host unreachable

```
PC1> ip dhcp
DORA IP 192.168.2.15/24 GW 192.168.2.1
PC1> ping 192.168.2.1 
192.168.2.1 icmp_seq=1 timeout
192.168.2.1 icmp_seq=2 timeout
192.168.2.1 icmp_seq=3 timeout
192.168.2.1 icmp_seq=4 timeout
192.168.2.1 icmp_seq=5 timeout
```

```
996:~$ sudo tcpdump  -i any -n icmp 
tcpdump: data link type LINUX_SLL2
tcpdump: verbose output suppressed, use -v[v]... for full protocol decode
listening on any, link-type LINUX_SLL2 (Linux cooked v2), snapshot length 262144 bytes
15:09:28.094550 ens18 In  IP 192.168.2.15 > 192.168.2.1: ICMP echo request, id 30907, seq 1, length 64
15:09:30.094642 ens20 Out IP 192.168.2.15 > 192.168.2.1: ICMP echo request, id 31419, seq 2, length 64
15:09:30.094734 ens18 In  IP 192.168.2.15 > 192.168.2.1: ICMP echo request, id 31419, seq 2, length 64
15:09:31.206109 lo    In  IP 192.168.2.1 > 192.168.2.1: ICMP host 192.168.2.15 unreachable, length 92
15:09:31.206114 lo    In  IP 192.168.2.1 > 192.168.2.1: ICMP host 192.168.2.15 unreachable, length 92
15:09:32.094792 ens20 Out IP 192.168.2.15 > 192.168.2.1: ICMP echo request, id 31931, seq 3, length 64
15:09:32.094859 ens18 In  IP 192.168.2.15 > 192.168.2.1: ICMP echo request, id 31931, seq 3, length 64
15:09:34.095502 ens20 Out IP 192.168.2.15 > 192.168.2.1: ICMP echo request, id 32443, seq 4, length 64
15:09:34.095559 ens18 In  IP 192.168.2.15 > 192.168.2.1: ICMP echo request, id 32443, seq 4, length 64
```

<img width="1077" height="575" alt="Image" src="https://github.com/user-attachments/assets/33040c7a-dd1d-4474-8b8d-818d97ce2af7" />
